{
  "executive_summary": "Deterministic review found a suspicious PowerShell alert on an approved victim host with historical live-validation evidence for the same behavior family.",
  "confirmed_observations": [
    "Alert source reported powershell.exe on VICTIM-MAYURI with technique T1059.001.",
    "Historical live validation record VAL-2026-001 exists for the same detection family.",
    "Victim host is approved and snapshot-capable according to current lab inventory."
  ],
  "candidate_findings": [
    "Behavior matches suspicious PowerShell decode-and-execute semantics but requires fresh live replay to reconfirm latency and present-state telemetry."
  ],
  "candidate_attack_mappings": [
    "T1059.001"
  ],
  "scope_questions": [
    "Did the same user or process lineage appear on other hosts within the same time window?",
    "Did PowerShell lead to persistence or external network activity?"
  ],
  "recommended_hunts": [
    "HUNT-2026-001 suspicious PowerShell review"
  ],
  "recommended_collections": [
    "powershell-execution"
  ],
  "detection_opportunities": [
    "Generalize decode+execute PowerShell behavior while suppressing benign read-only commands."
  ],
  "missing_evidence": [
    "Fresh Splunk webhook delivery evidence",
    "Current-run Velociraptor collection output",
    "Current-run Hayabusa or Chainsaw output"
  ],
  "unsupported_assumptions": [
    "Do not conclude maliciousness from the alert alone.",
    "Do not assume current Open WebUI or Ollama availability."
  ],
  "confidence": "low"
}
